{
  "schemaVersion": "1.0",
  "messageId": "reply_message_01",
  "caseId": "d3a1c87e-4b80-460b-97d6-1f3c4583122e",
  "correlationId": "correlation_demo_01",
  "turnId": "turn_demo_01",
  "replyId": "reply_demo_01",
  "contextRevision": 7,
  "kind": "explanation",
  "locale": "de",
  "text": "Im aktuellen bestätigten Stand beträgt der jährliche Überschuss oder Fehlbetrag CHF 51'600.00. Dies ist eine Momentaufnahme mit den erfassten Angaben.",
  "requiresConfirmation": false,
  "containsFinancialAmounts": true,
  "contextId": "1b2edec7f6bf8a78d901a285f79f4ca5766d564794728f9f8820bce1350bca73",
  "runId": "d8760030-3d66-4e6b-bded-bbbb61cbf1af",
  "profileVersion": 1,
  "scenarioVersionId": "baseline_v1",
  "calculationInputHash": "27589131a5408153d786379bf72dad1f2e2458ce18699265cc45c4632a75113d",
  "factRefs": [
    {
      "metricId": "cashflowAnnual",
      "runId": "d8760030-3d66-4e6b-bded-bbbb61cbf1af",
      "profileVersion": 1,
      "scenarioVersionId": "baseline_v1",
      "sourceRefs": [
        "demo:person1-net-income",
        "demo:person2-net-income",
        "demo:rent",
        "demo:living",
        "demo:tax-already-in-net",
        "demo:existing-contributions",
        "demo:no-debt-service",
        "demo:regular-reserve-saving",
        "demo:chosen-buffer"
      ]
    }
  ]
}
